key,parent_id,summary,description,Acceptance_crieteria,labels,components,parent_key,Requested_by,timeestimate,Due_date,status,Acceptance_result,Acceptance_improvement,summary_result,summary_suggestion
DIS-1,10000,Enable biometric authentication for mobile banking app,"As a retail banking customer, I want to log in to the mobile banking app using biometric authentication (Face ID or fingerprint), so I can securely access my account without typing my password each time. This should work on both iOS and Android, and fallback to password if biometric fails.","Given a user has enabled biometric authentication in the app settings,
When they open the mobile banking app,
Then they should be prompted for biometric verification,
And upon successful authentication, they should be logged in automatically,
And if biometric authentication fails, they should be redirected to the password login screen.",,APS1,TP-1,PRD20252 - Claims | RTB - Enhancement/New feature,108000,2025-12-30,To Do,Well Documented,"{'strengths': ['Follows Given-When-Then format', 'Clear and understandable language', 'Covers both success and failure scenarios'], 'improvement_areas': ['Does not handle cases where biometric authentication is unavailable or fails due to technical issues'], 'revised_version': 'Given a user has enabled biometric authentication in the app settings,\nWhen they open the mobile banking app,\nThen they should be prompted for biometric verification,\nAnd upon successful authentication, they should be logged in automatically,\nAnd if biometric authentication fails, they should be redirected to the password login screen,\nAnd if biometric authentication is unavailable, they should be notified with an error message and redirected to the password login screen.'}",GOOD,Implement biometric authentication (Face ID/fingerprint) for secure mobile banking login across iOS and Android.
DIS-2,10003,Add transaction dispute option for credit card users,"Credit card customers should be able to raise a dispute for specific transactions through the mobile and web apps. This feature should allow users to select a reason, upload supporting documents, and track the status of their dispute.","Given a user is viewing their credit card transaction history,
When they click ""Dispute Transaction"" on an eligible entry,
Then they should be prompted to select a dispute reason and optionally upload evidence,
And upon submission, the dispute case should be created and visible in a ""Disputes"" tab with a tracking ID.",['CTB'],APS1,TP-4,PRD202782 - recovery | CTB - New feature,3600,2025-12-30,To Do,Well Documented,"{'strengths': ['Clear structure using Given-When-Then format', 'Specifies user action and expected system response', 'Mentions the creation of a dispute case and its visibility', 'Includes the concept of a tracking ID'], 'improvement_areas': ['Eligibility criteria for transactions is not defined', 'No mention of validation for uploaded evidence', 'No confirmation or notification after submission', 'No details on what the user sees in the Disputes tab'], 'revised_version': ""Given a user is viewing their credit card transaction history, When they click 'Dispute Transaction' on an eligible entry (e.g., transactions within the last 90 days), Then they should be prompted to select a dispute reason from predefined categories (e.g., 'Unauthorized Transaction', 'Incorrect Amount') and optionally upload evidence (e.g., images or documents), And upon submission, the dispute case should be created, a confirmation message displayed, and the case visible in a 'Disputes' tab with a tracking ID and status 'Under Review'.""}",GOOD,"Add transaction dispute feature for credit card users with reason selection, document upload, and status tracking"
DIS-3,10004,Fix notifications,"To comply with regulatory guidelines, customers with expiring KYC documents must receive timely notifications. These should include push notifications, emails, and in-app banners, starting 30 days prior to expiry.","Given a customer’s KYC document is expiring in less than 30 days,
When they log into any digital banking channel,
Then they should see a notification banner about re-verification,
And an email and push notification should be triggered every 10 days until re-submission,
And once re-submitted, the reminders should stop.",['RTB'],TES1,TP-5,PRD22532 - Claims | RTB - New feature,140400,2025-12-30,To Do,Well Documented,"{'strengths': ['Follows the Given-When-Then format correctly.', 'Clearly states the condition, trigger, and expected outcomes.'], 'improvement_areas': [""The term 'any digital banking channel' is too vague and should specify the channels."", 'Lack of specific details about the notification content and frequency.', 'No mention of escalation steps if the user ignores reminders.'], 'revised_version': ""Given a customer’s KYC document is expiring in less than 30 days, When they log into the mobile app or web portal, Then they should see a notification banner stating 'Your KYC document will expire soon. Please re-verify.' And an email and push notification should be triggered every 10 days until re-submission, And once re-submitted, the reminders should stop. Additionally, if no action is taken after 20 days, a final reminder with escalation details should be sent.""}",Needs Improvement,"Implement KYC expiry notifications via push, email, and in-app banners starting 30 days prior to document expiry."
DIS-4,10002,Launch AI-powered personal financial assistant,Description for feature 4 for DIS,"* Analyze monthly spending and categorize into predefined buckets.
* Alert users if they spend 20% more than usual in any category.
* Recommend saving plans based on income and spending history.
* Should support user queries like “How much did I spend on food last month?”",['CTB'],,TP-3,PRD19252 - Claims and recovery | CTB - New feature,100800,2025-12-30,To Do,,,,
DIS-5,10000,Redesign the business loan application portal,Users should be able to do stuff related to disputes. This is kind of needed for credit card things.,,['RTB'],TES1,TP-1,PRD89252 - Recovery | RTB - New feature,115200,2025-12-17,To Do,,,Needs Improvement,Enable dispute resolution functionality for credit card transactions
DIS-6,10002,Allow customers to add payees using mobile number,Users should be able to add a new payee to their beneficiary list using the recipient's mobile number if it’s linked to a UPI ID or bank account.,"Given a customer wants to add a payee,
When they enter a mobile number,
Then the payee is added.",['CTB'],APS1,TP-3,PRD79902 - recovery | CTB - Enhancement/New feature,93600,2025-12-30,To Do,Not Well Documented,"{'strengths': ['Follows Given-When-Then format', 'Clear and straightforward'], 'improvement_areas': ['Lack of validation details', 'No confirmation or feedback mentioned', 'No error handling for duplicates or invalid numbers'], 'revised_version': ""Given a customer wants to add a payee, When they enter a valid mobile number that hasn't been used before, Then the payee is successfully added and a confirmation message is displayed. If the mobile number is invalid or already exists, Then an error message is shown.""}",GOOD,Enable customers to add payees via mobile number linked to UPI ID or bank account.
DIS-7,10001,Introduce scheduled payments for recurring bills,"Retail banking users should be able to schedule automatic payments for recurring bills (e.g., utilities, insurance premiums). This feature should support adding/editing/deleting schedules and send reminders 1 day before the scheduled payment.","Given a user has set up a scheduled bill payment,
When the scheduled date arrives,
Then the system should automatically process the payment using the saved funding account,
And an SMS and email confirmation should be sent,
And if the account has insufficient balance, the user should be notified and the transaction retried once in 24 hours.",['RTB'],EBSNF,TP-2,PRD20782 - Claims and recovery | RTB - Enhancement,36000,2025-12-30,To Do,Well Documented,"{'strengths': ['Follows the Given/When/Then format', 'Covers multiple scenarios including error handling', 'Specific about notifications (SMS and email)', 'Includes a retry mechanism for failed transactions'], 'improvement_areas': ['The Given could be more specific about the setup details', 'The When could specify when the balance check occurs', 'The Then could clarify the content of notifications', 'The retry timing and subsequent actions could be more detailed'], 'revised_version': 'Given a user has set up a scheduled bill payment with a funding account,\nWhen the scheduled date arrives and the payment is processed,\nThen the system should automatically process the payment using the saved funding account,\nAnd send an SMS and email confirmation with payment details,\nAnd if the account has insufficient balance, the user should be notified immediately,\nAnd the transaction should be retried once after 24 hours,\nAnd if the retry fails, the user should be notified again with further instructions.'}",Needs Improvement,Implement automatic payment scheduling with reminders for recurring bills
