key,parent_id,summary,description,Acceptance_crieteria,labels,components,parent_key,Requested_by,timeestimate,Due_date,status,Acceptance_result,Acceptance_improvement,summary_result,summary_suggestion
DIS-4,10002,Launch AI-powered personal financial assistant,Description for feature 4 for DIS,"* Analyze monthly spending and categorize into predefined buckets.
* Alert users if they spend 20% more than usual in any category.
* Recommend saving plans based on income and spending history.
* Should support user queries like 'How much did I spend on food last month ?'.",['CTB'],,TP-3,PRD19252 - Claims and recovery | CTB - New feature,100800,2025-02-05,To Do,Not Well Documented,"{'strengths': ['Covers multiple functionalities', 'Clear in their intention'], 'improvement_areas': ['Not in Given-When-Then format', 'Lack of specific details', 'Missing conditions for functionality'], 'revised_version': ""Given the user has monthly spending data, when the system analyzes the data, then it categorizes the spending into predefined buckets. Given the user's spending in a category, when it exceeds 20% of the usual amount, then the system alerts the user. Given the user's income and spending history, when the system analyzes the data, then it recommends a saving plan. Given the user asks 'How much did I spend on food last month?', when the system retrieves the data, then it displays the amount spent on food.""}",Needs Improvement,Launch AI-powered personal financial assistant for smart money management
DIS-6,10002,Allow customers to add payees using mobile number,Users should be able to add a new payee to their beneficiary list using the recipient's mobile number if it’s linked to a UPI ID or bank account.,"Given a customer wants to add a payee,
When they enter a mobile number,
Then the payee is added.",['CTB'],APS1,TP-3,PRD79902 - recovery | CTB - Enhancement/New feature,93600,2025-02-25,To Do,Not Well Documented,"{'strengths': ['Follows the Given-When-Then format', 'Clear and straightforward scenario'], 'improvement_areas': ['Lack of validation for mobile number format', 'No handling of duplicate payees', 'No specification of user feedback or system response'], 'revised_version': ""Given a customer wants to add a payee, When they enter a valid mobile number that hasn't been used before, Then the payee is added, a confirmation message is displayed, and the payee appears in the payee list.""}",Good,Enable customers to add payees using mobile number linked to UPI ID or bank account
